,Column1,NAME,NUMBER OF COURSES,companyname,coursetype,URL2,Column5
496,465,Preparing for Google Cloud Certification: Cloud Data Engineer Professional Certificate en Español,6.0,Google Cloud,SPECIALIZATION,https://www.coursera.org/specializations/gcp-data-engineer-es,
497,53,Preparing for Google Cloud Certification: Cloud DevOps Engineer,5.0,Google Cloud,PROFESSIONAL CERTIFICATE,https://www.coursera.org/professional-certificates/sre-devops-engineer-google-cloud,
498,36,Preparing for Google Cloud Certification: Cloud Engineer,6.0,Google Cloud,PROFESSIONAL CERTIFICATE,https://www.coursera.org/professional-certificates/cloud-engineering-gcp,
499,469,Preparing for Google Cloud Certification: Cloud Engineer Professional Certificate en Español,6.0,Google Cloud,SPECIALIZATION,https://www.coursera.org/specializations/cloud-engineering-gcp-es,
500,48,Preparing for Google Cloud Certification: Cloud Network Engineer,4.0,Google Cloud,PROFESSIONAL CERTIFICATE,https://www.coursera.org/professional-certificates/google-cloud-networking,
501,44,Preparing for Google Cloud Certification: Cloud Security Engineer,7.0,Google Cloud,PROFESSIONAL CERTIFICATE,https://www.coursera.org/professional-certificates/google-cloud-security,
502,55,Preparing for Google Cloud Certification: Machine Learning Engineer,9.0,Google Cloud,PROFESSIONAL CERTIFICATE,https://www.coursera.org/professional-certificates/preparing-for-google-cloud-machine-learning-engineer-professional-certificate,
503,227,"Presentation Skills: Speechwriting, Slides and Delivery",4.0,National Research Tomsk State University,SPECIALIZATION,https://www.coursera.org/specializations/presentation-skills,
504,120,Pricing Strategy Optimization,4.0,University of Virginia,SPECIALIZATION,https://www.coursera.org/specializations/uva-darden-bcg-pricing-strategy,
505,462,Privacy and Standardisation,5.0,EIT Digital,SPECIALIZATION,https://www.coursera.org/specializations/privacy,
506,197,Probabilistic Graphical Models,3.0,Stanford University,SPECIALIZATION,https://www.coursera.org/specializations/probabilistic-graphical-models,
507,393,"Product Ideation, Design, and Management",5.0,"University of Maryland, College Park",SPECIALIZATION,https://www.coursera.org/specializations/product-ideation-design-and-management,
508,568,Professional IQ: Preventing and Solving Problems at Work,4.0,University of Illinois at Urbana-Champaign,SPECIALIZATION,https://www.coursera.org/specializations/professional-iq,
509,220,Professional Skills for the Workplace,4.0,"University of California, Davis",SPECIALIZATION,https://www.coursera.org/specializations/professional-skills-for-the-workplace,
510,290,Programming in C++: A Hands-on Introduction,4.0,Codio,SPECIALIZATION,https://www.coursera.org/specializations/hands-on-cpp,
511,558,Programming in Java: A Hands-on Introduction,4.0,Codio,SPECIALIZATION,https://www.coursera.org/specializations/hands-on-java,
512,438,Programming in Python: A Hands-on Introduction,4.0,Codio,SPECIALIZATION,https://www.coursera.org/specializations/hands-on-python,
513,205,Programming with Google Go,3.0,"University of California, Irvine",SPECIALIZATION,https://www.coursera.org/specializations/google-golang,
514,112,Project Management & Other Tools for Career Development,5.0,"University of California, Irvine",SPECIALIZATION,https://www.coursera.org/specializations/project-management-success,
515,117,Project Management Principles and Practices,4.0,"University of California, Irvine",SPECIALIZATION,https://www.coursera.org/specializations/project-management,
516,85,Python 3 Programming,5.0,University of Michigan,SPECIALIZATION,https://www.coursera.org/specializations/python-3-programming,
517,476,Python Data Products for Predictive Analytics,4.0,University of California San Diego,SPECIALIZATION,https://www.coursera.org/specializations/python-data-products-for-predictive-analytics,
518,402,Python for Cybersecurity,5.0,Infosec,SPECIALIZATION,https://www.coursera.org/specializations/pythonforcybersecurity,
519,17,Python for Everybody,4.0,University of Michigan,SPECIALIZATION,https://www.coursera.org/specializations/python,
520,380,Python Scripting for DevOps,4.0,LearnQuest,SPECIALIZATION,https://www.coursera.org/specializations/python-scripting-devops,
521,311,Qualitative Research Design and Methods for Public Health,3.0,Emory University,SPECIALIZATION,https://www.coursera.org/specializations/qualitative-research-design-and-methods-for-public-health,
522,261,Quantitative Finance,3.0,HSE University,SPECIALIZATION,https://www.coursera.org/specializations/quantitative-finance,
523,258,Quantum Computing: from Basics to the Cutting Edge,4.0,Saint Petersburg State University,SPECIALIZATION,https://www.coursera.org/specializations/quantum-computing-from-basics-to-the-cutting-edge,
524,358,Real-Time Embedded Systems,4.0,University of Colorado Boulder,SPECIALIZATION,https://www.coursera.org/specializations/real-time-embedded-systems,
525,158,Real-World Product Management,4.0,Advancing Women in Tech,SPECIALIZATION,https://www.coursera.org/specializations/real-world-product-management,
526,399,Recommender Systems,5.0,University of Minnesota,SPECIALIZATION,https://www.coursera.org/specializations/recommender-systems,
527,97,Regulatory Compliance,4.0,University of Pennsylvania,SPECIALIZATION,https://www.coursera.org/specializations/regulatory-compliance,
528,77,Reinforcement Learning,4.0,University of Alberta,SPECIALIZATION,https://www.coursera.org/specializations/reinforcement-learning,
529,574,Representante de desarrollo de ventas de Salesforce,5.0,Salesforce,PROFESSIONAL CERTIFICATE,https://www.coursera.org/professional-certificates/desarrollo-ventas-salesforce,
530,440,Requirements Engineering: Secure Software Specifications,5.0,University of Colorado System,SPECIALIZATION,https://www.coursera.org/specializations/requirements-engineering-secure-software,
531,331,Responsive Website Development and Design,6.0,University of London,SPECIALIZATION,https://www.coursera.org/specializations/website-development,
532,196,Robotics,6.0,University of Pennsylvania,SPECIALIZATION,https://www.coursera.org/specializations/robotics,
533,245,Russian for beginners А1. Русский язык: A1,4.0,Saint Petersburg State University,SPECIALIZATION,https://www.coursera.org/specializations/russian-for-beginners-a1,
534,400,Sales Operations/Management,5.0,West Virginia University,SPECIALIZATION,https://www.coursera.org/specializations/sales-operations,
535,385,Sales Training for High Performing Teams,4.0,HubSpot Academy,SPECIALIZATION,https://www.coursera.org/specializations/sales-training-high-performing-teams,
536,289,Salesforce Fundamentals,4.0,"University of California, Irvine",SPECIALIZATION,https://www.coursera.org/specializations/salesforce-fundamentals,
537,191,Salesforce Sales Development Representative,5.0,Salesforce,PROFESSIONAL CERTIFICATE,https://www.coursera.org/professional-certificates/sales-development-representative,
538,157,Salesforce Sales Operations,4.0,Salesforce,PROFESSIONAL CERTIFICATE,https://www.coursera.org/professional-certificates/salesforce-sales-operations,
539,335,SAS Advanced Programmer,3.0,SAS,PROFESSIONAL CERTIFICATE,https://www.coursera.org/professional-certificates/sas-advanced-programmer,
540,162,SAS Programmer,4.0,SAS,PROFESSIONAL CERTIFICATE,https://www.coursera.org/professional-certificates/sas-programming,
541,488,SAS Statistical Business Analyst,3.0,SAS,PROFESSIONAL CERTIFICATE,https://www.coursera.org/professional-certificates/sas-statistical-business-analyst,
542,306,SAS Visual Business Analytics,5.0,SAS,PROFESSIONAL CERTIFICATE,https://www.coursera.org/professional-certificates/sas-visual-business-analytics,
543,619,Scale Up Your Startup,4.0,IE Business School,SPECIALIZATION,https://www.coursera.org/specializations/scaleup-specialization,
544,345,School Health for Children and Adolescents,4.0,University of Colorado System,SPECIALIZATION,https://www.coursera.org/specializations/school-health-for-children-and-adolescents,
545,122,Scrum Master Certification,4.0,LearnQuest,SPECIALIZATION,https://www.coursera.org/specializations/learnquest-certified-scrum-master,
546,98,Search Engine Optimization (SEO),5.0,"University of California, Davis",SPECIALIZATION,https://www.coursera.org/specializations/seo,
547,353,Secure Coding Practices,4.0,"University of California, Davis",SPECIALIZATION,https://www.coursera.org/specializations/secure-coding-practices,
548,566,Secure Software Design,4.0,University of Colorado System,SPECIALIZATION,https://www.coursera.org/specializations/secure-software-design,
549,81,Security Analyst Fundamentals,3.0,IBM,SPECIALIZATION,https://www.coursera.org/specializations/security-analyst-fundamentals,
550,51,Security in Google Cloud,4.0,Google Cloud,SPECIALIZATION,https://www.coursera.org/specializations/security-google-cloud-platform,
551,121,Self-Driving Cars,4.0,University of Toronto,SPECIALIZATION,https://www.coursera.org/specializations/self-driving-cars,
552,524,Semiconductor Devices,3.0,University of Colorado Boulder,SPECIALIZATION,https://www.coursera.org/specializations/semiconductor-devices,
553,450,Serverless Data Processing with Dataflow,3.0,Google Cloud,SPECIALIZATION,https://www.coursera.org/specializations/serverless-data-processing-with-dataflow,
554,183,Six Sigma Black Belt,8.0,University System of Georgia,SPECIALIZATION,https://www.coursera.org/specializations/six-sigma-black-belt,
555,228,Six Sigma Green Belt,4.0,University System of Georgia,SPECIALIZATION,https://www.coursera.org/specializations/six-sigma-green-belt,
556,108,Six Sigma Yellow Belt,4.0,University System of Georgia,SPECIALIZATION,https://www.coursera.org/specializations/six-sigma-fundamentals,
557,550,Social Entrepreneurship,3.0,Copenhagen Business School,SPECIALIZATION,https://www.coursera.org/specializations/social-entrepreneurship-cbs,
558,166,Social Media Marketing,6.0,Northwestern University,SPECIALIZATION,https://www.coursera.org/specializations/social-media-marketing,
559,365,Social Media Marketing in Practice,4.0,Digital Marketing Institute,SPECIALIZATION,https://www.coursera.org/specializations/social-media-marketing-practice,
560,346,Social Policy for Social Services & Health Practitioners,5.0,Columbia University,SPECIALIZATION,https://www.coursera.org/specializations/social-welfare-policy,
561,190,Software Design and Architecture,4.0,University of Alberta,SPECIALIZATION,https://www.coursera.org/specializations/software-design-architecture,
562,392,Software Development Lifecycle,4.0,University of Minnesota,SPECIALIZATION,https://www.coursera.org/specializations/software-development-lifecycle,
563,154,Software Product Management,5.0,University of Alberta,SPECIALIZATION,https://www.coursera.org/specializations/product-management,
564,278,Software Testing and Automation,4.0,University of Minnesota,SPECIALIZATION,https://www.coursera.org/specializations/software-testing-automation,
565,398,"Solar Energy for Engineers, Architects and Code Inspectors",3.0,University at Buffalo,SPECIALIZATION,https://www.coursera.org/specializations/solar-energy,
566,456,Solving Complex Problems,4.0,Macquarie University,SPECIALIZATION,https://www.coursera.org/specializations/solving-complex-problems,
567,181,"Songwriting: Writing, Arranging, and Producing Music",4.0,Berklee College of Music,SPECIALIZATION,https://www.coursera.org/specializations/songwriting,
568,188,Soporte de Tecnologías de la Información de Google,5.0,Crece con Google,PROFESSIONAL CERTIFICATE,https://www.coursera.org/professional-certificates/soporte-de-tecnologias-de-informacion-google,
569,224,Spacecraft Dynamics and Control,4.0,University of Colorado Boulder,SPECIALIZATION,https://www.coursera.org/specializations/spacecraft-dynamics-control,
570,141,Sports Performance Analytics,5.0,University of Michigan,SPECIALIZATION,https://www.coursera.org/specializations/sports-analytics,
571,589,Spring Framework,4.0,LearnQuest,SPECIALIZATION,https://www.coursera.org/specializations/spring-framework,
572,513,Startup Entrepreneurship,4.0,Technion - Israel Institute of Technology,SPECIALIZATION,https://www.coursera.org/specializations/startup-entrepreneurship,
573,193,Statistical Analysis with R for Public Health,4.0,Imperial College London,SPECIALIZATION,https://www.coursera.org/specializations/statistical-analysis-r-public-health,
574,266,Statistical Inference for Data Science Applications,3.0,University of Colorado Boulder,SPECIALIZATION,https://www.coursera.org/specializations/statistical-inference-for-data-science-applications,
575,356,Statistical Modeling for Data Science Applications,3.0,University of Colorado Boulder,SPECIALIZATION,https://www.coursera.org/specializations/statistical-modeling-for-data-science-applications,
576,607,Statistical Thermodynamics,5.0,University of Colorado Boulder,SPECIALIZATION,https://www.coursera.org/specializations/statistical-thermodynamics-engineering,
577,234,Statistics with Python,3.0,University of Michigan,SPECIALIZATION,https://www.coursera.org/specializations/statistics-with-python,
578,125,Statistics with R,5.0,Duke University,SPECIALIZATION,https://www.coursera.org/specializations/statistics,
579,600,Strategic Business Analytics,4.0,ESSEC Business School,SPECIALIZATION,https://www.coursera.org/specializations/strategic-analytics,
580,135,Strategic Leadership and Management,7.0,University of Illinois at Urbana-Champaign,SPECIALIZATION,https://www.coursera.org/specializations/strategic-leadership,
581,257,Strategic Management and Innovation,4.0,Copenhagen Business School,SPECIALIZATION,https://www.coursera.org/specializations/strategic-management,
582,457,Strategic Sales Management,5.0,Fundação Instituto de Administração,SPECIALIZATION,https://www.coursera.org/specializations/sales-management-bridging-gap-strategy-sales,
583,442,Strategising: Management for Global Competitive Advantage,4.0,Macquarie University,SPECIALIZATION,https://www.coursera.org/specializations/strategic-management-competitive-advantage,
584,617,Strategy and Finance for the lifecycle of a Social Business,5.0,Yunus Social Business Fund Bengaluru,SPECIALIZATION,https://www.coursera.org/specializations/strategy-and-finance-for-social-business,
585,371,Suporte em TI do Google,5.0,Cresça com o Google,PROFESSIONAL CERTIFICATE,https://www.coursera.org/professional-certificates/suporte-em-ti-do-google,
586,155,Supply Chain Analytics,5.0,Rutgers the State University of New Jersey,SPECIALIZATION,https://www.coursera.org/specializations/supply-chain-analytics,
587,337,Supply Chain Finance and Blockchain Technology,4.0,New York Institute of Finance,SPECIALIZATION,https://www.coursera.org/specializations/supply-chain-finance-and-blockchain-technology,
588,95,Supply Chain Management,5.0,Rutgers the State University of New Jersey,SPECIALIZATION,https://www.coursera.org/specializations/supply-chain-management,
589,298,Survey Data Collection and Analytics,7.0,"University of Maryland, College Park",SPECIALIZATION,https://www.coursera.org/specializations/data-collection,
590,254,Swift 5 iOS Application Developer,4.0,LearnQuest,SPECIALIZATION,https://www.coursera.org/specializations/swift-5-ios-app-developer,
591,426,System Issues in Cloud Computing,4.0,Georgia Institute of Technology,SPECIALIZATION,https://www.coursera.org/specializations/cloud,
592,322,Systems Biology and Biotechnology,6.0,Icahn School of Medicine at Mount Sinai,SPECIALIZATION,https://www.coursera.org/specializations/systems-biology,
593,582,Teach English: Intermediate Grammar,4.0,"University of California, Irvine",SPECIALIZATION,https://www.coursera.org/specializations/teach-english,
594,595,Teaching Impacts of Technology in K-12 Education,6.0,University of California San Diego,SPECIALIZATION,https://www.coursera.org/specializations/teach-impacts-technology-k12-education,
595,492,Teaching Writing,5.0,Johns Hopkins University,SPECIALIZATION,https://www.coursera.org/specializations/teaching-writing,
596,299,TensorFlow 2 for Deep Learning,3.0,Imperial College London,SPECIALIZATION,https://www.coursera.org/specializations/tensorflow2-deeplearning,
597,74,TensorFlow: Advanced Techniques,4.0,DeepLearning.AI,SPECIALIZATION,https://www.coursera.org/specializations/tensorflow-advanced-techniques,
598,262,TensorFlow: Data and Deployment,4.0,DeepLearning.AI,SPECIALIZATION,https://www.coursera.org/specializations/tensorflow-data-and-deployment,
599,86,"TESOL Certificate, Part 1: Teach English Now!",4.0,Arizona State University,SPECIALIZATION,https://www.coursera.org/specializations/tesol,
600,171,"TESOL Certificate, Part 2: Teach English Now!",4.0,Arizona State University,SPECIALIZATION,https://www.coursera.org/specializations/tesol-certificate-2,
601,585,Test-Driven Development,4.0,LearnQuest,SPECIALIZATION,https://www.coursera.org/specializations/test-driven-development,
602,207,The Art of Sales: Mastering the Selling Process,4.0,Northwestern University,SPECIALIZATION,https://www.coursera.org/specializations/the-art-of-sales-mastering-the-selling-process,
603,93,The Business of Health Care,4.0,University of Pennsylvania,SPECIALIZATION,https://www.coursera.org/specializations/healthcare-administration-management,
604,96,The Business of Music Production,4.0,Berklee College of Music,SPECIALIZATION,https://www.coursera.org/specializations/business-music-production,
605,102,The DIY Musician,4.0,Berklee College of Music,SPECIALIZATION,https://www.coursera.org/specializations/diy-musician,
606,387,The Fundamentals of Personal Finance,5.0,SoFi,SPECIALIZATION,https://www.coursera.org/specializations/personal-finance-fundamentals,
607,417,The Influence of Social Determinants on Health,3.0,University of Michigan,SPECIALIZATION,https://www.coursera.org/specializations/social-determinants-on-health,
608,168,The Pronunciation of American English,4.0,"University of California, Irvine",SPECIALIZATION,https://www.coursera.org/specializations/american-english-pronunciation,
609,119,The Singer Songwriter,4.0,Berklee College of Music,SPECIALIZATION,https://www.coursera.org/specializations/singer-songwriter,
610,439,The Teacher and Social and Emotional Learning (SEL),5.0,University of Colorado Boulder,SPECIALIZATION,https://www.coursera.org/specializations/teacher-sel,
611,130,Think like a CFO,4.0,IESE Business School,SPECIALIZATION,https://www.coursera.org/specializations/thinklikeacfo,
612,563,Tidyverse Skills for Data Science in R,5.0,Johns Hopkins University,SPECIALIZATION,https://www.coursera.org/specializations/tidyverse-data-science-r,
613,296,TOEFL Preparation,3.0,"University of California, Irvine",SPECIALIZATION,https://www.coursera.org/specializations/toefl-preparation,
614,344,Trading Strategies in Emerging Markets,5.0,Indian School of Business,SPECIALIZATION,https://www.coursera.org/specializations/trading-strategy,
615,184,Transforming the Fashion Business,3.0,"Parsons School of Design, The New School",SPECIALIZATION,https://www.coursera.org/specializations/transforming-fashion-business,
616,173,U.S. Federal Taxation,5.0,University of Illinois at Urbana-Champaign,SPECIALIZATION,https://www.coursera.org/specializations/united-states-federal-taxation,
617,40,UCI Project Management,,"University of California, Irvine",PROFESSIONAL CERTIFICATE,https://www.coursera.org/professional-certificate/applied-project-management,
618,115,UI / UX Design,4.0,California Institute of the Arts,SPECIALIZATION,https://www.coursera.org/specializations/ui-ux-design,
619,576,Understanding Modern Finance,5.0,Moscow Institute of Physics and Technology,SPECIALIZATION,https://www.coursera.org/specializations/understanding-modern-finance,
620,369,Unity XR: How to Build AR and VR Apps,3.0,Unity,SPECIALIZATION,https://www.coursera.org/specializations/unity-xr,
621,187,User Experience Research and Design,6.0,University of Michigan,SPECIALIZATION,https://www.coursera.org/specializations/michiganux,
622,432,User Interface Design,4.0,University of Minnesota,SPECIALIZATION,https://www.coursera.org/specializations/user-interface-design,
623,554,Valuation and Financial Analysis For Startups,5.0,Yonsei University,SPECIALIZATION,https://www.coursera.org/specializations/startup-valuation,
624,267,Value Chain Management,7.0,University of Illinois at Urbana-Champaign,SPECIALIZATION,https://www.coursera.org/specializations/value-chain-management,
625,555,Value Creation Through Innovation,5.0,EIT Digital,SPECIALIZATION,https://www.coursera.org/specializations/value-creation-innovation,
626,410,Value-Based Care,7.0,University of Houston,SPECIALIZATION,https://www.coursera.org/specializations/value-based-care,
627,404,Virtual Reality,5.0,University of London,SPECIALIZATION,https://www.coursera.org/specializations/virtual-reality,
628,305,Virtual Teacher,5.0,"University of California, Irvine",SPECIALIZATION,https://www.coursera.org/specializations/virtual-teacher,
629,354,Vital Skills for Data Science,4.0,University of Colorado Boulder,SPECIALIZATION,https://www.coursera.org/specializations/vital-skills-for-data-science,
630,186,Web Applications for Everybody,4.0,University of Michigan,SPECIALIZATION,https://www.coursera.org/specializations/web-applications,
631,114,Web Design for Everybody: Basics of Web Development & Coding,5.0,University of Michigan,SPECIALIZATION,https://www.coursera.org/specializations/web-design,
